id,category,subcategory,question,slug,answer,answer_type,policies
81,Економіка,Енергетика,Як реформуватимемо енергетичну систему України?,iak_reformuvatimemo_energetichnu_sistemu_ukrayini,Впровадження поновлювальної енергетики,checkbox,"Для подолання дефіциту електроенергії необхідне підвищення частки електростанцій, що працюють не на спалюванні викопного палива,– атомних електростанцій, гідроелектростанцій і станцій, що використовують поновлювані джерела енергії. Що стосується опалення та ГВП, тут основне завдання – замінити газові та мазутні котли на електричні котли і котли, що спалюють інші види палива (пелети, ТПВ тощо). {УКРОП}

Енергетика України потребує перетворень. Одним з пріоритетних завдань нової України є досягнення енергетичної автономії і подолання залежності від поставок російського газу. Крім того, шлях європейської інтеграції, обраний Україною, передбачає перехід від спалювання нафти і газу до поновлюваних джерел енергії, в даний час успішно здійснюваний США, ЄС, Японією. Без урахування цього найважливішого завдання включитися в загальний енергетично-технологічний контекст економічно розвинених країн неможливо. {УКРОП}

Розвиток альтернативних джерел енергозабезпечення надважливий для України. Держава повинна стимулювати їх розробку, зокрема, створювати умови для реалізації проектів, які сприятимуть скороченню споживання природного газу. Інша важлива складова стратегії скорочення споживання природного газу – запровадження енергозбережних технологій. {БПП}

Частка відновлювальних джерел енергії та біопалива в енергоспоживанні має бути на рівні кращих світових зразків. Стимулювання розвитку альтернативних джерел енергоресурсів збереже екологію та здоров’я людей, забезпечить енергетичну та економічну безпеку держави, підтримає наукові розробки, зробить конкурентноздатними наші виробництва. {Аграрна партія}

Ухвалити державну програму розвитку та впровадження альтернативної енергетики (дизпаливо з вугілля, біопаливо, вітрова, сонячна та гідроелектроенергія). Ліквідувати всі штучні обмеження та фінансові бар’єри для підприємницького середовища, територіальних громад та громадян щодо розвитку та використання альтернативних джерел енергії. Вдосконалити системи пільг для енергоощадних технологій. Запровадити енергоощадні технології на державних та комунальних об’єктах. Вдосконалити систему пільгового кредитування проектів із покращення енергоефективності як для малого й середнього бізнесу, так і для домогосподарств. {Свобода}

Енергобаланс України має бути сучасним. Частка вугілля та вуглеводнів мусить суттєво зменшитися і лишитися наступним поколінням, а держава має залучити в країну сучасні енергетичні технології альтернативної (вітряної та сонячної) генерації, атомної енергетики III та IV поколінь. {Національний корпус}"
80,Економіка,Сільське господарство,"Кожен політик знає, що село — то колиска України. Яким чином підтримаємо його?",kozhen_politik_znaie_shcho_selo_to_koliska_ukrayini_iakim_chinom_pidtrimaiemo_iogo,Підтримка сільськогосподарських кооперативів,checkbox,"Держава повинна надавати підтримку створенню та розвитку кооперативів в різних галузях сільського господарства з метою підвищення ступеня переробки і виробництва конкурентоспроможних на світових ринках продуктів харчування. {УКРОП}

Ми забезпечимо розвиток кооперації, створення системи інституцій і складових інфраструктури для їхнього ефективного функціонування та включення в організований аграрний ринок. Стимулювання підприємницької ініціативи у сільській місцевості сприятиме створенню нових робочих місць, підвищенню рівня зайнятість на селі та наповненню місцевих бюджетів. {Аграрна партія}

Для надання фермерським господарствам великотоварного характеру і захисту інтересів селян від посередницьких структур пропонується розвиток виробничої і торгово-обслуговуючої кооперації. {Відродження}"
79,Економіка,Сільське господарство,"Кожен політик знає, що село — то колиска України. Яким чином підтримаємо його?",kozhen_politik_znaie_shcho_selo_to_koliska_ukrayini_iakim_chinom_pidtrimaiemo_iogo,Підтримка фермерських господарств,checkbox,"Розвиток фермерських господарств, малих та середніх виробників сільськогосподарської продукції є пріоритетом розвитку аграрного сектора. Необхідні спеціальні дотаційні програми, а також вільний доступ таких виробників на ринки та залучення іноземного капіталу. {БПП}

Ми організуємо та законодавчо забезпе­чимо пільгове, під 8-10% річних, креди­тування фермерів, малих сімейних підприємств та особистих селянських господарств. {Батьківщина}

Саме тому партія пропонує ухва­лити Закон, згідно якого праця 2-х млн. самозайнятих селян в особистому госпо­дарстві буде зарахована до загального трудового стажу. Велике значення для успішного майбутнього села відіграє створення повних циклів виро­щування і переробки сільськогосподарської продукції та виробництво виключно екологічно чистих продуктів харчування. {Батьківщина}

Суттєвої підтримки в становленні та розвитку потребують сімейні фермерські господарства та інші малі й середні суб’єкти господарювання, що є основою інтеграційних процесів міста і села. {Аграрна партія}

Закріплення на рівні Конституції норми, згідно з якою основою сільськогосподарського виробництва в Україні є фермерське господарство. {Відродження}"
78,Економіка,Сільське господарство,"Кожен політик знає, що село — то колиска України. Яким чином підтримаємо його?",kozhen_politik_znaie_shcho_selo_to_koliska_ukrayini_iakim_chinom_pidtrimaiemo_iogo,Ведення земельного реєстру,checkbox,"Передумовою для формування прозорого ринку землі має стати системна інвентаризація земельних ресурсів країни. Землі мають бути чітко розмежовані в єдиному державному реєстрі. Вони повинні бути поділені на землі сільськогосподарського призначення, державної, комунальної та приватної власності. {БПП}

Створимо прозорий земельний кадастр, що унеможливить земельне рейдерство. {Радикальна партія}

Повністю прозора структура власності в Україні: запровадження публічно доступного обов’язкового реєстру прав приватної власності, матеріальних і нематеріальних активів; надання інформації про кінцевого бенефіціара під час проведення усіх операцій з купівлі-продажу, при відкритті банківських рахунків, участі в тендерах з державних закупівель. {Громадянська позиція}

Ухвалити новий Земельний кодекс та затвердити його на всеукраїнському референдумі. Провести повну інвентаризацію земельних ресурсів України. {Свобода}"
77,Економіка,Сільське господарство,Чи будемо продавати землю сільськогосподарського призначення?,chi_budemo_prodavati_zemliu_silskogospodarskogo_priznachennia,Вільний продаж сільськогосподарської землі,radio,Ключове завдання реформи сільського господарства – вирішення питання формування прозорого ринку землі. Це відкриє нові можливості для надходження інвестицій в аграрний сектор та активного виходу української продукції на міжнародні ринки. {БПП}
76,Економіка,Сільське господарство,Чи будемо продавати землю сільськогосподарського призначення?,chi_budemo_prodavati_zemliu_silskogospodarskogo_priznachennia,Продовження мораторію на продаж сільськогосподарської землі,radio,"Земля сільськогосподарського призначення має бути визнана національним надбанням України. Мораторій на продаж сільськогосподарських земель має бути продовжений, а орендні відносини переглянуті в інтересах громадян-власників земельних паїв з урахуванням реальних ринкових ставок. {УКРОП}

Партія послідовно виступає проти продажу сільськогосподарської зем­лі. Ми пропонуємо провести наступну земельну реформу: земельні паї у селян, які бажають їх продати, буде викупляти лише держава, пара­лельно буде підвищено орендну плату за земельні паї' мінімум до 5% їх реальної вартості. {Батьківщина}

Ми заборонимо продаж землі і ліквідуємо нелегальний земельний ринок, на якому збагачуються товстосуми та спекулянти. Запровадимо право оренди землі під жорстким контролем держави. Заборонимо іноземцям розпоряджатися нашими чорноземами. {Радикальна партія}

Земля в Україні повинна належати тим, хто її обробляє. Збереження мораторію на продаж землі сільськогосподарського призначення доти, допоки не будуть створені умови для запровадження ринку (зниження рівня корупції, необхідна інфраструктура, жорсткий контроль над використанням). {Відродження}

Запровадження дієвого інституту довгострокової оренди земель сільськогосподарського призначення з можливістю застави для отримання кредиту та передачі права оренди у спадок нащадкам. {Громадянська позиція}

Заборонити в Україні торгівлю землею сільськогосподарського призначення. Надавати її у довгострокове володіння українським громадянам із правом родинного успадкування. Визначити законом підстави припинення такого володіння в разі використання сільськогосподарських земель за нецільовим призначенням або в разі погіршення стану (родючості) ґрунтів. {Свобода}

Мораторій на купівлю та продаж земель сільськогосподарського призначення має бути подовжений до завершення україно-російської війни та подолання наслідків економічної кризи. {Національний корпус}"
75,Економіка,Регулювання економіки та фінансова система,Який курс на деолігархізацію економіки ви візьмете (і чи візьмете)?,iakii_kurs_na_deoligarkhizatsiiu_ekonomiki_vi_vizmete_i_chi_vizmete,У державних компаній — іноземні керівники,checkbox,"До управління державними активами повинні залучатися міжнародні керівні компанії, які мають високий рейтинг і гарну ділову репутацію. Однією з конкурсних умов при залученні керівної компанії завжди має бути обов'язок забезпечити працівникам підприємства стабільні зарплати і соціальні пакети. {УКРОП}

Керівники державних компаній обираються на прозорих конкурсах і автоматично звільняються у разі недосягнення ключових показників ефективності. У випадку досягнення корпоративних цілей, керівництво державних компаній має право на першочерговий та пільговий викуп акцій своєї компанії в якості винагороди. {Національний корпус}

У державній власності мають перебувати тільки прибуткові та стратегічні підприємства. До управління ними повинні залучатися найкращі управлінці, які мають досвід роботи на українському та міжнародних ринках. {БПП}"
74,Економіка,Регулювання економіки та фінансова система,Який курс на деолігархізацію економіки ви візьмете (і чи візьмете)?,iakii_kurs_na_deoligarkhizatsiiu_ekonomiki_vi_vizmete_i_chi_vizmete,Створення державних компаній в стратегічних галузях,checkbox,"Природні багатства України та її промисловий потенціал усе ще дозволяють створити такі компанії в низці ключових галузей: Національна гірничо-металургійна компанія, Національна нафтогазова компанія, Національна енергетична компанія, Національна хімічна компанія, Національна аграрна компанія, Національна транспортна компанія, Національна компанія оборонної промисловості. Навіть зараз, в умовах кризи, такі компанії можуть давати мільярди доларів чистого прибутку. {УКРОП}

Партія виступає кате­горично проти приватизації україн­ської газотранспортної системи (ГТС), «Укрзалізниці», «Енергоатому», Одесь­кого припортового заводу та інших стра­тегічно важливих державних підприємств та монополій, які сьогодні дають роботу та забезпечують соціальні гарантії сотнямтисяч громадян, стабільно наповнюють місцевий і державний бюджети. {Батьківщина}

Встановити державний контроль над природними монополіями. Ухвалити закон про державні корпорації. Використовувати найкращі практики управління успішними державними підприємствами країн Європи і світу для збільшення ефективності українських держпідприємств. {Свобода}

Формування нового індустріального ядра з порівняно невеликих, але мобільних високотехнологічних, наукоємних підприємств, орієнтованих на експорт. Треба мати на увазі, що Україна, яка входить у зону вільної торгівлі з ЄС, є дуже вигідним місцем для розташування виробництв азіатських (передусім китайських) компаній. {Відродження}"
73,Економіка,Регулювання економіки та фінансова система,Який курс на деолігархізацію економіки ви візьмете (і чи візьмете)?,iakii_kurs_na_deoligarkhizatsiiu_ekonomiki_vi_vizmete_i_chi_vizmete,Розміщення контрольних пакетів акцій на біржах,checkbox,"Протягом одного року всі промислові підприємства, які розташовані й працюють на території України, мають стратегічне значення для економіки і національної безпеки, а також критичне значення для забезпечення життя людей на певних територіях, повинні бути зобов'язані відкрити своїх кінцевих бенефіціарів і провести обов’язкове розміщення контрольних пакетів своїх акцій – спочатку на вітчизняних, а потім і на світових фондових біржах. {УКРОП}

Проведення ревізії державних підприємств, структури їх власності та торговельних зв’язків. Олігархічні холдинги не повинні володіти блокуючим пакетом акцій у державних підприємствах. Паразитарні структури потрібно усунути від поставок і продажу продукції держпідприємств. {Відродження}

Решта акцій державних компаній вільно розміщується на Національному фондовому ринку. {Національний корпус}"
72,Економіка,Регулювання економіки та фінансова система,"Багато успішних державних підприємств було приватизовано за безцінь, а збиткові, навпаки, продовжуть тиснути на бюджет. Давайте розберемося з цим. ",bagato_uspishnikh_derzhavnikh_pidpriiemstv_bulo_privatizovano_za_beztsin_a_zbitkovi_navpaki_prodovzhut_tisnuti_na_biudzhet_davaite_rozberemosia_z_tsim,Доплата за попередню приватизацію підприємств олігархами,checkbox,"Різницю між цією оцінкою і сумою, реально сплаченою при приватизації, скориговану на зміну вартості грошей з дати приватизації до теперішнього часу, власники повинні будуть компенсувати, або підприємство буде повернуте у державну власність без компенсації. У випадку, якщо підприємство змінило власника, претензія щодо доплати виставляється першому власникові (у разі його банкрутства в результаті даного зобов’язання – державі у власність передається частка в акціонерному капіталі від власника на поточний момент). {УКРОП}

Олігархи доплатять за копійчану приватизацію підприємств, які приносять їм надприбутки. Інакше ці підприємства будуть знову повернуті державі. {Радикальна партія}

Перевірити законність приватизації великих підприємств. Повернути у державну власність незаконно приватизовані об’єкти або зобов’язати власників протягом року сплатити різницю між вартістю, що надійшла від такої приватизації до держбюджету, та справедливою вартістю цих об’єктів, враховуючи втрачену для держави вигоду. Не допускати приватизації прибуткових підприємств. {Свобода}"
