id,category,subcategory,question,slug,answer,answer_type,policies
112,Соціальна політика,Комунальне господарство та тарифи,"Якби створюючи цей генератор ми брали до уваги зовнішню рекламу, це питання мало б бути першим (і єдиним). Отже, що ви обіцяєте зробити з комунальним господарством і послугами?
",iakbi_stvoriuiuchi_tsei_generator_mi_brali_do_uvagi_zovnishniu_reklamu_tse_pitannia_malo_b_buti_pershim_i_iedinim_otzhe_shcho_vi_obitsiaiete_zrobiti_z_komunalnim_gospodarstvom_i_poslugami,Запровадження справедливих тарифів,checkbox,"Ми будемо відстоювати і контролювати: формування тарифів на послуги монополістів – постачальників комунальних послуг; зменшення та приведення тарифів до економічно обґрунтованих відповідно до висновків незалежних аудиторів. {Наш край}

Заморозити тарифи та ціни. Зупинити безконтрольне зростання вартості життя. Скасувати драконівську пенсійну реформу, гарантувати повне фінансування соціальних пільг, пенсій та допомог. {Опоблок}

Встановлювати для населення економічно обґрунтовані, співмірні з рівнем прожиткового мінімуму та мінімальним розміром заробітної плати тарифи на житлово-комунальні послуги. Ліквідувати наявні корупційні схеми при формуванні тарифів. {Свобода}

Ми будемо вимагати розробки і прийняття державної програми зниження тарифів для населення. Зокрема, енергоносії вітчизняного видобування мають спрямовуватися на потреби ЖКГ не за ринковою, а за соціальною ціною, максимально наближеною до собівартості. {Відродження}"
111,Соціальна політика,Медицина,"Про медичну реформу зараз говорять усі, скажімо щось і ми",pro_medichnu_reformu_zaraz_govoriat_usi_skazhimo_shchos_i_mi,Лікарнями керуватимуть професійні управлінці,checkbox,"Управляти медичними закладами повинні кваліфіковані менеджери. В системі управління державними закладами має буде здійснено відокремлення управлінських, господарчих та власне професійних функцій. Це означає, що в медичних закладах має діяти практика, коли головний лікар відповідає за медичну частину, а фінансово-господарськими питаннями займається професійний управлінець. {БПП}

Ліцензування медичної діяльності та контроль якості – прерогатива незалежного об’єднання медиків-професіоналів, із обов’язковим залученням до складу комісій визнаних фахівців з країн з високим рівнем медицини. {УКРОП}

Український лікар стає конкурентоспроможним та професійним. Ліцензування лікарської справи передається самоврядній національній асоціації медичних робітників. Разом з тим, держава збільшує покарання за медичну помилку лікаря або його службову халатність. Держава та приватний сектор будуть конкурувати за справжніх фахівців. {Національний корпус}"
110,Соціальна політика,Медицина,"Про медичну реформу зараз говорять усі, скажімо щось і ми",pro_medichnu_reformu_zaraz_govoriat_usi_skazhimo_shchos_i_mi,Створення дієвих наглядових громадських рад при лікарнях,checkbox,"Корупція у сфері закупівель медичних препаратів та обладнання має бути подолана, зокрема через впровадження електронних процедур та процесів, запровадження чітких протоколів лікування, а також через децентралізацію управління медичними закладами – обрання головних лікарів та створення дієвих наглядових громадських рад при лікарнях. {УКРОП}

Державним медичним установам надається автономія у господарській діяльності та кадровому забезпечені. Разом із тим, усі витрати та закупівлі мають бути здійснені через прозору систему державних закупівель. {Національний корпус}"
109,Соціальна політика,Медицина,"Про медичну реформу зараз говорять усі, скажімо щось і ми",pro_medichnu_reformu_zaraz_govoriat_usi_skazhimo_shchos_i_mi,Збільшення зарплат лікарів,checkbox,"Медичним працівникам на рівні закону повинна бути гарантована гідна платня за працю. {УКРОП}

Лікарі мають отримувати гідну плату за свою роботу. Це досягається не за рахунок необґрунтованих «ставок» у лікарнях, а лише шляхом фінансування державою лікарських послуг, наданих конкретним людям. {Національний корпус}

Становлення незалежної, шанованої, самоврядної та відповідальної професії медичного працівника, а також забезпечення гідної винагороди за лікарську працю. {Самопоміч}"
108,Соціальна політика,Медицина,"Про медичну реформу зараз говорять усі, скажімо щось і ми",pro_medichnu_reformu_zaraz_govoriat_usi_skazhimo_shchos_i_mi,Покращення якості медичних закладів і послуг,checkbox,"Громадяни мають невід’ємне право на якісну і доступну медичну допомогу на всій території країни і в будь-який час. У великих містах будуть створені високотехнологічні державні медичні центри, направлення до яких муніципальними медичними установами має здійснюватися в суворо фіксовані терміни після звернення. Якщо обласний центр здоров’я не може допомогти пацієнтові, пацієнт повинен бути безкоштовно транспортований в інше місто. {УКРОП}

Державні та приватні медичні заклади повинні мати однакові можливості для надання послуг пацієнтам. {БПП}

Зміщення акцентів на профілактику та ранню діагностику захворювань. Запобігання інфекційним та іншим соціально-небезпечним хворобам. {Самопоміч}

Медицина в сучасному світі стає більш технологічною та більш дорогою. Держава за власний рахунок побудує сучасні міжрегіональні науково-медичні центри, які будуть спроможними об’єднати найсучасніші діагностику, терапію (насамперед ― педіатрію), хірургію, трансплантологію та протезування з науковими дослідженнями та системою медичної освіти. Саме тут будуть підготовані кадри для вітчизняної медицини. Саме з цих інноваційних центрів почнеться відродження національної медицини. {Національний корпус}"
107,Соціальна політика,Медицина,"Про медичну реформу зараз говорять усі, скажімо щось і ми",pro_medichnu_reformu_zaraz_govoriat_usi_skazhimo_shchos_i_mi,Вибір пацієнтом лікаря,checkbox,В українській медицині має запрацювати принцип вільного вибору пацієнтами лікаря. {БПП}
106,Соціальна політика,Медицина,"Про медичну реформу зараз говорять усі, скажімо щось і ми",pro_medichnu_reformu_zaraz_govoriat_usi_skazhimo_shchos_i_mi,Безкоштовної невідкладна та первинна медичної допомоги,checkbox,"Держава повинна гарантувати всім громадянам високу якість безкоштовної невідкладної та первинної медичної допомоги, а також безкоштовний широкий набір якісних медичних послуг, який визначається окремим законом, до якого входять, зокрема обслуговування в жіночих консультаціях та пологових будинках, лікування важких хронічних і смертельно небезпечних захворювань, зокрема залежностей, паліативна терапія, включно з хоспісами. {УКРОП}

Визначення пакету безоплатних медичних послуг, який держава гарантує кожній людині, незалежно від її статусу і місця проживання, за бюджетний кошт. {Громадянська позиція}

Держава виділить на медицину в 10 разів більше коштів ніж зараз. Зробимо фельдшерсько-акушерський пункт в кожному селі. {Радикальна партія}

Безкоштовна медицина в рамках програми має бути доступною для соціально вразливих та малозабезпечених верств населення. {БПП}

Держава забезпечить запровадження наступних принципів роботи національної медичної системи: загальні витрати держави на медичну галузь не мають бути меншими, ніж 10% від ВВП; абсолютна доступність на території України екстреної медичної допомоги; доступний на території країни перелік безкоштовних базових медичних послуг (включно із забезпеченням медикаментами); зменшення рівня смертності; збільшення середнього віку життя; соціологічно підтверджена задоволеність населення якістю наданих медичних послуг. {Національний корпус}

Право на безкоштовне одержання медичних послуг малозабезпеченим верствам населення та пенсіонерам, підвищення стандартів їхнього медичного обслуговування. {Наш край}

Усім громадянам України гарантувати доступ до безкоштовних медичних та освітніх послуг. {Опоблок}

Запровадити дієві механізми фінансування базового пакета медичних послуг кожному мешканцю України, в тому числі через запровадження системи медичного страхування. {Свобода}"
105,Соціальна політика,Медицина,"Про медичну реформу зараз говорять усі, скажімо щось і ми",pro_medichnu_reformu_zaraz_govoriat_usi_skazhimo_shchos_i_mi,Запровадження системи медичного страхування,checkbox,"Держава зобов’язана забезпечити високі стандарти страхової медицини світового рівня. Громадяни повинні отримати право самостійно наповнювати додаткові особисті рахунки в новому Фонді соціально-медичного страхування. Збереження цих коштів має гарантувати держава. Громадяни повинні мати право передавати залишки коштів на цих рахунках у спадок. {УКРОП}

Складовою системи соціального забезпечення має стати загальнообов’язкове державне медичне страхування. {БПП}

У країні має бути запроваджене обов’язкове медичне страхування, гарантоване державою. Це дасть змогу залучити в систему охорони здоров’я фінансування,  а також підвищити якість надання послуг, наблизивши їх безпосередньо до пацієнта. {БПП}

Людина має отримати економічний стимул бути здоровим через механізми медичного страхування. Разом з тим, люди, які не потребували в поточному році державних медичних послуг, в наступному отримуватимуть додаткові медичні послуги (наприклад, стоматологічні) за рахунок держави. {Національний корпус}

Запровадження часткового медичного страхування шляхом організації лікарняних кас для забезпечення хворих медикаментами. {Наш край}

Запровадження медичного страхування. {Самопоміч}

Заохочення приватного медичного страхування життя і здоров’я людини. {Громадянська позиція}

Необхідно широко запроваджувати страхову медицину та виходити на рівень кращих світових норм і стандартів. Роботодавці мають в обов’язковому порядку страхувати всіх найманих працівників, а стимулом повинно стати не оподаткування страхових платежів. Впровадження обов’язкового щорічного профілактичного медичного огляду забезпечить виявлення хвороб на початковому етапі і збереже життя тисяч громадян. {Аграрна партія}"
104,Соціальна політика,Екологія,Екологія — важлива тема і тут не може бути компромісів,ekologiia_vazhliva_tema_i_tut_ne_mozhe_buti_kompromisiv,Відповідальність за забруднення довкілля,checkbox,"Одночасно має бути посилена відповідальність за забруднення довкілля. Особлива відповідальність має бути за забруднення заповідників, заказників, водойм та природоохоронних і відпочинкових зон. {БПП}

Стимулювання розвитку та впровадження екологічно чистих технологій; безумовне дотримання стандартів захисту довкілля на виробництві; жорсткі штрафні санкції за порушення екологічних вимог. {Громадянська позиція}

Збереження природних ресурсів та екологічна безпека є під постійною увагою Партії. Загострення проблем в природоохоронній сфері вимагає посилення правової відповідальності за негативний антропогенний вплив діяльності людини на навколишнє середовище. {Аграрна партія}

Зобов’язати фізичні та юридичні особи відшкодовувати місцевій громаді збитки, завдані довкіллю. {Свобода}

Кримінальна відповідальність за жорстоке поводження з домашніми та безпритульними тваринами буде посилена. «Догхантерство» та подібні ганебні явища, що суперечить усталеним у європейській культурі засадам ставлення до живих істот, буде ліквідовано. {Національний корпус}

Експорт необробленої деревини буде заборонено. Буде втілено жорсткі кримінальні покарання за незаконну вирубку лісу. {Національний корпус}"
103,Соціальна політика,Екологія,Екологія — важлива тема і тут не може бути компромісів,ekologiia_vazhliva_tema_i_tut_ne_mozhe_buti_kompromisiv,"Додаткові виплати від держави для громадян, що проживають на екологічно забруднених територіях",checkbox,"Громадяни, які проживають на територіях підвищених екологічних ризиків, мають бути забезпечені додатковими грошовими виплатами шляхом перерахування на їхні медичні страхові рахунки екологічного збору підприємств. {УКРОП}

Створити єдину державну систему розвитку спеціальної соціальної інфраструктури та стандартів соціального захисту населення, яке проживає на територіях можливого екологічно небезпечного впливу гірничодобувних, переробних та інших виробничих об’єктів. Зобов’язати великі підприємства сировинно-інтенсивних галузей провести екологічну модернізацію засобів виробництва. {Свобода}"
102,Соціальна політика,Екологія,Екологія — важлива тема і тут не може бути компромісів,ekologiia_vazhliva_tema_i_tut_ne_mozhe_buti_kompromisiv,Захист довкілля,checkbox,"Держава повинна надати допомогу громадянам у впровадженні енергозбереження на рівні кожного будинку. {УКРОП}

В Україні має бути збільшена кількість об’єктів природно-заповідного фонду, загальна площа природоохоронних територій має бути доведена до європейських показників. {БПП}

Потребує гармонізації та впровадження законодавство в частині захисту довкілля. Ми маємо забезпечити людині чисте повітря, якісну питну воду, зберегти унікальну екосистему України: джерела та ріки, ліси і поля, землю для якісного здорового життя громадян. {Аграрна партія}

Створити систему державного та громадського контролю за дотриманням законодавства у царині охорони навколишнього природного середовища, забезпечити автономність і незалежність екологічного нагляду та контролю. {Свобода}

Держава створює єдиний реєстр геологічної та геофізичної інформації та єдиний державний кадастр природних ресурсів і пам’яток природи. Здійснюється екологічне районування території України, визначення екологічно допустимих меж видобутку природних ресурсів та обмежень забруднення навколишнього середовища. {Національний корпус}

Держава створює умови для побудови сучасних сміттєпереробних заводів. Ці заводи включаються до системи тепло- та енергопостачання в цих містах. {Національний корпус}"
