id,category,subcategory,question,slug,answer,answer_type,policies
55,Політична система,Місцеве самоврядування,Що пропонуєте для реформи місцевого самоврядування?,shcho_proponuiete_dlia_reformi_mistsevogo_samovriaduvannia,Управлінська автономія громад,checkbox,"Децентралізація здійснюється за європейським принципом субсидіарності – владні повноваження в тій чи іншій сфері опускаються на найнижчий з рівнів, на якому вони можуть ефективно виконуватися. Це означає, що велика частина повноважень місцевої влади буде передана на найбільш низький рівень – рівень громади. Саме органи влади громади зможуть найкращим чином задовольнити потребу громадян в якісному місцевому самоврядуванні. {УКРОП}

Повноваження органів місцевого самоврядування поділяються на власні та делеговані. Власні повноваження – це сфера відповідальності місцевої влади, за яку вона відповідає самостійно і фінансує виконання цих повноважень з власних доходів. Саме виходячи з принципу достатності для здійснення власних повноважень місцевим самоврядуванням і здійснюватиметься передача на місцевий рівень податків та інших джерел фінансування. Делеговані повноваження – в першу чергу, це забезпечення освітніх і медичних установ – передаються місцевому самоврядуванню центральними органами влади, але забезпечуються коштами центрального державного бюджету, а місцеве самоврядування зобов’язується підтримувати в цих сферах певні загальнодержавні стандарти. {УКРОП}

В першу чергу, маємо провести реформу місцевого самоврядування, яка дасть наба­гато ширші права територіальним громадам у відповідності з Європейською хартією місце­вого самоврядування. Дана реформа передба­чає ліквідацію районних та обласних державних адміністрацій разом із їх головами. {Батьківщина}

Держава має передати місцевому самоврядуванню максимально можливу кількість повноважень, при цьому необхідно припинити практику дублювання функцій (компетенцій) між державою та місцевим самоврядуванням. Місцеві громади краще знають як вирішувати свої проблеми! {Наш край}

Громади мають отримати дієві інструменти впливу на ключові питання місцевого значення. Такими інструментами мають стати запроваджені на рівні  закону місцеві плебісцити, регіональні референдуми, ефективні механізми впливу на місцевих чиновників. {БПП}

Децентралізація влади дозволить значно прискорити розвиток громад і країни в цілому. Громади мають стати головним елементом в конструкції, на якій базується держава. Розвиток місцевого самоврядування має відбуватися у чіткій відповідності з Європейською хартією місцевого самоврядування та «12 європейськими принципами належного врядування». До управління громадами мають бути залучені найкращі управлінці-господарники з досвідом ефективного господарювання. {Наш край}
"
54,Політична система,Судова система та правоохоронні органи,Щось нове створюватимемо?,shchos_nove_stvoriuvatimemo,Муніципальна поліція,checkbox,"Запровадження муніципальних органів правопорядку. {Самопоміч}

Створення муніципальної поліції, яка має підпорядковуватись місцевій раді. {Наш край}

Муніципальна міліція є органом, який забезпечує правопорядок в межах території, на яку поширюється юрисдикція відповідного місцевого самоврядування. Муніципальна міліція підпорядкована виконавчому органу місцевого самоврядування та підзвітна представницькому органу місцевого самоврядування. Її утримання здійснюється коштом місцевого бюджету. До складу муніципальної міліції увійдуть як постійно найняті службовці, так і добровольці (волонтери), які згодились епізодично виконувати функції охорони громадського порядку не на постійній основі. Повноваження і обов’язки у цих двох категорій представників муніципальної міліції під час здійснення охорони громадського порядку однакові. Керівник муніципальної міліції обирається населенням шляхом загальних виборів або призначається місцевим представницьким органом. {УКРОП}

В рамках реформи надамо право облас­ним та районним радам формувати влас­ні виконавчі комітети та муніципальну міліцію. Тобто, керувати областю та районом будуть обрані місцевими мешканцями депута­ти та голови відповідних рад. Саме ці, обрані громадою люди, будуть нести відповідальність за виконану роботу перед місцевими мешканця­ми на кожних наступних виборах. {Батьківщина}

Вбачаємо доцільним створення окремих військової (в структурі армії) та муніципальної (підпорядкованої громадам) варти. {БПП}

Муніципальна поліція є самоврядним органом, відповідальним за правопорядок в межах території, на яку поширюється юрисдикція відповідного органу місцевого самоврядування. Муніципальна поліція підзвітна відповідним органам місцевого самоврядування. Її утримання здійснюється коштом місцевого бюджету. До структур муніципальної поліції включається патрульна поліція та дільничні поліцейські структури. Крім того, до роботи муніципальної поліції залучаються добровольчі громадські формування з охорони громадського порядку. {Національний корпус}

Створення місцевими громадами муніципальної поліції («муніципальної варти»), яка б здійснювала основну частину роботи з профілактики та припинення злочинів, а також охоронні й контрольні функції. {Відродження}"
53,Політична система,Судова система та правоохоронні органи,Щось нове створюватимемо?,shchos_nove_stvoriuvatimemo,Суди присяжних,checkbox,"Держава зміцнює інститут суду присяжних. Замість сучасної профанації ― суд присяжних перетворюється на дієвий інститут правосуддя. Кожен громадянин має право на розгляд його справи судом присяжних. У випадку обрання громадянина присяжним, держава гарантує йому збереження робочого місця та заробітної плати. Участь у суді присяжних є громадським обов’язком, та не може бути відхиленою громадянином, за винятком екстрених обставин. {Національний корпус}

Судову систему необхідно привести у відповідність до європейських вимог, забезпечивши реальне верховенство права в державі. Суди мають бути незалежними та справедливими, що можливо забезпечити в т.ч. через встановлення вікового цензу, виборність суддів, запровадження інституту суду присяжних. {Аграрна партія}

Запровадити реальну роботу суду присяжних. {Свобода}

Запровадження суду присяжних для окремих видів тяжких і особливо тяжких злочинів. {Відродження}

У кримінальному судочинстві в системі державних судів розгляд справ по суті (перша інстанція), у випадках встановлених законом, має здійснювати традиційно відомий суд присяжних. Склад такого суду формується стороною захисту і стороною обвинувачення за взаємною згодою. Професійний суддя (головуючий) може втручатися у цей процес лише з метою розв’язання спірної ситуації між стороною захисту і стороною обвинувачення, не беручи безпосередньої участі у відборі присяжних. До виконання громадянських обов’язків присяжних залучається все населення відповідного судового округу за виборчими списками. Головною ознакою такого суду має бути те, що він ухвалює рішення без участі професійного судді (справжній суд народу) і його виправдувальний вердикт не може бути оскаржений стороною звинувачення. {УКРОП}"
52,Політична система,Судова система та правоохоронні органи,Які тези щодо реформи судової та правоохоронної системи вам подобаються?,iaki_tezi_shchodo_reformi_sudovoyi_ta_pravookhoronnoyi_sistemi_vam_podobaiutsia,Переатестація поліцейських на конкурсній основі,checkbox,"Проведення повної переатестації поліцейських є інструментом очищення МВС.  Відбір на посади має відбуватися на конкурсній  основі із вдосконаленням системи їх підготовки за міжнародним стандартом (три рівні залежно від посад: базова, спеціалізована, вища). {БПП}"
51,Політична система,Судова система та правоохоронні органи,Які тези щодо реформи судової та правоохоронної системи вам подобаються?,iaki_tezi_shchodo_reformi_sudovoyi_ta_pravookhoronnoyi_sistemi_vam_podobaiutsia,Залучення міжнародних фахівців та досвіду,checkbox,"Для очищення судової та правоохоронної системи необхідно змінити процедуру формування Вищої ради юстиції – треба передбачити можливість формування ради частково з представників міжнародної юридичної спільноти (судді, прокурори, адвокати). {УКРОП}

Запровадити як найбільш об’єктивні підстави в процесі очищення суддівського корпусу – рішення Європейського суду з прав людини щодо скарг українських громадян на порушення прав людини з боку українських суддів. Судді, які винні в таких порушеннях, підлягають автоматичному звільненню. {УКРОП}"
50,Політична система,Судова система та правоохоронні органи,Які тези щодо реформи судової та правоохоронної системи вам подобаються?,iaki_tezi_shchodo_reformi_sudovoyi_ta_pravookhoronnoyi_sistemi_vam_podobaiutsia,Залучення громадськості,checkbox,"Передбачити впровадження дієвого інструменту протидії корупції, особливо щодо чиновників та представників правоохоронних органів. Для цього може бути законодавчо закріплене право громадян застосовувати пристрій прихованого аудіо- та відеозапису для фіксації факту вимагання хабара чиновником. Необхідно дозволити використання цього запису для подання до суду або слідчих органів – як підстави для автоматичного (упродовж 24 годин) відкриття кримінального провадження щодо хабарника. Це дозволило б у лічені місяці розпочати тисячі кримінальних проваджень проти хабарників і отримати рішення суду про їхнє засудження. {УКРОП}

Необхідно сформувати кваліфікацій­но-дисциплінарні комісії за участю громадянського суспільства і покласти на них контроль за діяльністю судів. Дати цим комісіям право накладати на суддів дисци­плінарні стягнення, ініціювати притягнення їх до кримінальної відповідальності та звільнення з посад. Ми маємо провести люстрацію суддів, причетних до порушень прав людини, ухвален­ня неправосудних рішень, політичних переслі­дувань, корупції. {Батьківщина}

Громадський контроль над діяльністю суддів. Підтримка громадських організацій: їх оцінка дій суддів повинна враховуватися відповідальними структурами судової системи. {Відродження}

Посилити вплив на призначення поліцейських на посаду через формування поліцейських комісій, більшість в яких будуть складати представники громадянського суспільства – відомі правозахисники, адвокати, юристи. {УКРОП}

Надати громаді право через районні, міські, обласні ради простою більшістю голосів висловлювати недовіру поліцейському, який не виконує покладених на нього функцій (окрім слідчого). {УКРОП}"
49,Політична система,Судова система та правоохоронні органи,Які тези щодо реформи судової та правоохоронної системи вам подобаються?,iaki_tezi_shchodo_reformi_sudovoyi_ta_pravookhoronnoyi_sistemi_vam_podobaiutsia,Створення жорстких механізмів контролю над судами і поліцією,checkbox,"Створити Державне бюро розслідувань як орган, відповідальний за розслідування злочинів у самій правоохоронній системі (у тому числі генерального прокурора, міністра внутрішніх справ, голови СБУ, директора НАБУ). Дуже важливо створити прозорий і ефективний механізм обрання голови Державного бюро розслідувань, який виключає політичний вплив. {УКРОП}

Державне бюро розслідувань стане головним органом державного слідства. До ДБР мають відійти функції слідства, які зараз виконує прокуратура. {БПП}

Підвищення відповідальності за злочини чи злочинну бездіяльність посадових осіб держави, прокурорів, правоохоронців зі скороченням чисельності та підвищенням оплати праці. {Самопоміч}

Невідворотність покарання судді за винесення неправосудних рішень гарантуватиме чесність правосуддя. Судді, які винесли неправомірне рішення,  повинні жорстко каратися, в тому числі персональним відшкодуванням завданих збитків. {БПП}

Партія пропонує запрова­дити механізм приватного обвинувачення, коли громадяни отримають право вести запис свого спілкування з чиновниками та звертатися напряму до суду для притягнення їх до відпові­дальності за зловживання. {Батьківщина}

Запровадити механізм відшкодування моральних та матеріальних збитків, яких зазнає особа або територіальна громада через неправомірні рішення органів державної влади, місцевого самоврядування чи окремих посадовців, у повному розмірі коштом винуватців. Відшкодовувати збитки за неправосудне рішення коштом судді, що його ухвалив. {Свобода}

На законодавчому рівні фіксується принцип персональної відповідальності суддів. Відшкодування збитків за неправомірне судове рішення здійснюється за персональний рахунок суддів. {Національний корпус}"
48,Політична система,Судова система та правоохоронні органи,Які тези щодо реформи судової та правоохоронної системи вам подобаються?,iaki_tezi_shchodo_reformi_sudovoyi_ta_pravookhoronnoyi_sistemi_vam_podobaiutsia,Переатестація суддів на конкурсній основі,checkbox,"Проведення повної переатестації суддів та їх відбору має здійснюватися на конкурсній основі. Запровадження багаторівневої перевірки суддів на професійність та доброчесність – тільки так можна будувати систему справедливих судів, які покликані стати головним інструментом захисту прав та свобод громадян. {БПП}

Призначення суддів має здійснюватися незалежним від політичного впливу спеціальним органом, який складатиметься із фахівців із бездоганною репутацією та працюватиме з якнайширшим залученням громадськості. {БПП}"
